{
  "$schema": "../schemas/channel.schema.json",
  "schemaVersion": "1.0.0",
  "id": "channel.product",
  "name": "Product",
  "description": "Task-oriented interfaces for Wonka products, internal tools, and agent workspaces.",
  "aliases": ["product", "app"],
  "lifecycle": "review_required",
  "stability": "beta",
  "introducedIn": "0.2.0",
  "allowedThemes": ["light", "dark"],
  "distribution": "external",
  "tokenSets": [
    "color",
    "semantic.color",
    "radius",
    "shadow",
    "typography",
    "motion",
    "component"
  ],
  "compatibleAssetIds": [
    "asset.logo.wordmark",
    "asset.logo.mark",
    "asset.font.inter-display",
    "asset.font.gt-sectra",
    "asset.logo.full",
    "asset.logo.lockup",
    "asset.logo.wordmark-ai"
  ],
  "constraints": [
    {
      "id": "responsive",
      "value": "Support 320px through large desktop layouts without horizontal scrolling.",
      "level": "required",
      "enforcement": "contract"
    },
    {
      "id": "accessibility",
      "value": "Text and visible focus indicators meet their WCAG 2.2 AA contrast thresholds.",
      "level": "required",
      "enforcement": "automated",
      "ruleId": "rule.contrast-aa"
    },
    {
      "id": "keyboard",
      "value": "Every interactive flow remains operable with a keyboard and retains visible focus.",
      "level": "required",
      "enforcement": "contract"
    },
    {
      "id": "reduced-motion",
      "value": "Non-essential motion respects the user’s reduced-motion preference.",
      "level": "required",
      "enforcement": "contract"
    },
    {
      "id": "interface-states",
      "value": "Interactive elements define loading, empty, error, disabled, focus, and success states where applicable.",
      "level": "required",
      "enforcement": "contract"
    },
    {
      "id": "distribution",
      "value": "Treat Product as externally distributed by default. Internal-only surfaces require a dedicated channel before verified_internal assets can be selected.",
      "level": "required",
      "enforcement": "contract"
    }
  ],
  "exportTargets": ["react", "css", "html"],
  "provenance": {
    "source": "Wonka product primitives",
    "owner": "Wonka Design System",
    "approvedBy": null,
    "approvedAt": null
  }
}
